{
  "schemaVersion": "1.0.0",
  "id": "efforthours-change-public-real-expansion",
  "version": "0.1.0",
  "description": "Blind host-AI teacher estimates for six immutable public open-source pull requests across .NET, JavaScript, and TypeScript.",
  "rubric": {
    "id": "change-ehe-work-item",
    "version": "1.0.0"
  },
  "records": [
    {
      "id": "record:change:github.com/axios/axios:pr-11094",
      "repository": {
        "id": "repository:github.com/axios/axios",
        "name": "axios",
        "sourceDigest": "sha256:6ceb27f5b61e71aef277e8c5089e3367a337d5ec4129ce47726e85fb1d1f9fbc"
      },
      "change": {
        "id": "change:github.com/axios/axios:pr-11094",
        "selectionKind": "base-head",
        "baseObjectId": "529ce70296334a0397f9e45e7dfa5658f6b6fdba",
        "headObjectId": "27b9d9761cba6fe477dfa6104527523ba2450ad4",
        "baseEvidenceDigest": "sha256:926f002364d972a8ce964074179115fb6ab0667dd50b0cf474cab703a08d267e",
        "headEvidenceDigest": "sha256:fa81b70b33feb6f1ca5dd08375e9f5917ecdb704236863df4e9c446467be3dc6",
        "finalDeltaDigest": "sha256:6ceb27f5b61e71aef277e8c5089e3367a337d5ec4129ce47726e85fb1d1f9fbc",
        "coverageTags": [
          "browser",
          "bug-fix",
          "external-integration",
          "javascript",
          "public-real-change",
          "pull-request",
          "unit-tests"
        ]
      },
      "profile": "implementation",
      "baselineId": "senior-contractor-2026-no-ai",
      "partition": "validation",
      "sourceEstimatorVersion": "change-seed/0.2.0\u002Bseed-rules/0.2.1",
      "sourceEstimateDigest": "sha256:b2b5224b7f70681add6e16ead891b61fed0c4245f24f1376131539b0577e7451",
      "source": {
        "dataClassification": "public-redistributable",
        "sourceReference": "https://github.com/axios/axios/pull/11094",
        "revision": "529ce70296334a0397f9e45e7dfa5658f6b6fdba..27b9d9761cba6fe477dfa6104527523ba2450ad4",
        "licenseExpression": "MIT",
        "redistributionAllowed": true,
        "notes": "Immutable base tree 25020340ec571e2becd17350cfb37e378d2460fd and head tree 5b34c5547f2051adcc5b705ac9c3f2abe0430b9f retain LICENSE blob 05006a51eb888282323883df740cd90ad72d0700. Review used the public final specification, final delta, bounded adjacent source, and a blind authoring packet; no candidate hours, contributor identity, activity, elapsed time, actual labor, commit count, or intermediate churn was used as an effort signal. No source excerpt is redistributed."
      },
      "review": {
        "status": "teacher-estimate",
        "completedOn": "2026-08-10",
        "reviewers": [
          {
            "id": "teacher:openai-codex-sol-max-2026-08",
            "kind": "host-ai",
            "role": "teacher",
            "modelId": "openai-codex",
            "modelVersion": "sol-max"
          }
        ],
        "notes": "Single disclosed host-AI teacher; no independent correction or adjudication. The teacher ranges were frozen without access to candidate hours or category totals and before compilation or evaluation. This is weak supervision, not actual labor, held-out accuracy, or production-readiness evidence."
      },
      "targets": [
        {
          "id": "target:change-item:capability-marginal:b9d1231ce0324b5a7144:review-0001",
          "category": "production-implementation",
          "title": "Expand Implement maintained internal logic for \u0027.\u0027 (server)",
          "scope": ".",
          "sourceWorkItemIds": [
            "change-item:capability-marginal:b9d1231ce0324b5a7144"
          ],
          "evidenceIds": [
            "change:path:121486b04a87ac1c6f13f397",
            "change:path:317ffe356eb21fea67aae703"
          ],
          "hours": {
            "low": 1.50,
            "expected": 2.50,
            "high": 4.00
          },
          "rationale": "Implement status-zero cancellation handling in the XHR lifecycle, preserve successful file reads through request, origin, and response URL evidence, and reuse browser-style URL preprocessing in the existing malformed-protocol guard.",
          "uncertaintyReasons": [
            "Browser event ordering, validateStatus bypass, relative URLs, and file-protocol exceptions interact at the adapter boundary."
          ]
        },
        {
          "id": "target:change-item:capability-marginal:c72f90d8ea8f507a5b48:review-0001",
          "category": "unit-testing",
          "title": "Expand Create represented unit tests for \u0027.\u0027 (server)",
          "scope": ".",
          "sourceWorkItemIds": [
            "change-item:capability-marginal:c72f90d8ea8f507a5b48:part-0001",
            "change-item:capability-marginal:c72f90d8ea8f507a5b48:part-0002",
            "change-item:capability-marginal:c72f90d8ea8f507a5b48:part-0003",
            "change-item:capability-marginal:c72f90d8ea8f507a5b48:part-0004"
          ],
          "evidenceIds": [
            "change:path:121486b04a87ac1c6f13f397",
            "change:path:a11dc2ba063016c9d475861b",
            "change:path:ac4d27e2afe65cf3f626aeb5"
          ],
          "hours": {
            "low": 2.00,
            "expected": 3.50,
            "high": 5.50
          },
          "rationale": "Create the represented browser and isolated-adapter regression coverage for canceled HTTP requests, file reads, responseURL absence, validateStatus bypass, page origins, and URL preprocessing.",
          "uncertaintyReasons": [
            "Fresh-module browser globals and a faithful XHR stub add setup complexity beyond the individual assertions."
          ]
        },
        {
          "id": "target:change-item:capability-modification:8d97c216a8da61ce4451:review-0001",
          "category": "documentation",
          "title": "Modify Author and verify maintained repository documentation",
          "scope": ".",
          "sourceWorkItemIds": [
            "change-item:capability-modification:8d97c216a8da61ce4451"
          ],
          "evidenceIds": [
            "change:path:2906fea3ec893bf8d630e735"
          ],
          "hours": {
            "low": 0.25,
            "expected": 0.50,
            "high": 0.75
          },
          "rationale": "Document the user-visible cancellation correction, compatibility rationale, error code, validateStatus behavior, and retained file-protocol exceptions in the maintained prerelease changelog.",
          "uncertaintyReasons": [
            "The note is concise but must state browser-version and compatibility details accurately."
          ]
        },
        {
          "id": "target:change-item:change-comprehension:8afcadccfea19ef08ef4:review-0001",
          "category": "specification-comprehension-and-domain-learning",
          "title": "Understand the bounded change specification",
          "scope": ".",
          "sourceWorkItemIds": [
            "change-item:change-comprehension:8afcadccfea19ef08ef4"
          ],
          "evidenceIds": [
            "change:path:121486b04a87ac1c6f13f397",
            "change:path:2906fea3ec893bf8d630e735",
            "change:path:317ffe356eb21fea67aae703",
            "change:path:a11dc2ba063016c9d475861b",
            "change:path:ac4d27e2afe65cf3f626aeb5",
            "change:path:de0eb77c697692f27af8adb4"
          ],
          "hours": {
            "low": 1.00,
            "expected": 1.50,
            "high": 2.50
          },
          "rationale": "Understand XHR completion and cancellation ordering, Axios settlement semantics, browser URL preprocessing, and the legitimate status-zero file cases before choosing the rejection boundary.",
          "uncertaintyReasons": [
            "The defect depends on a browser-specific event-shape change plus cross-environment file behavior."
          ]
        },
        {
          "id": "target:change-item:change-review:a849df28c57a339f8b2d:review-0001",
          "category": "self-review-and-system-integration",
          "title": "Review and integrate the completed change",
          "scope": ".",
          "sourceWorkItemIds": [
            "change-item:change-review:a849df28c57a339f8b2d"
          ],
          "evidenceIds": [
            "change:path:121486b04a87ac1c6f13f397",
            "change:path:2906fea3ec893bf8d630e735",
            "change:path:317ffe356eb21fea67aae703",
            "change:path:a11dc2ba063016c9d475861b",
            "change:path:ac4d27e2afe65cf3f626aeb5",
            "change:path:de0eb77c697692f27af8adb4"
          ],
          "hours": {
            "low": 0.75,
            "expected": 1.00,
            "high": 1.75
          },
          "rationale": "Review error compatibility, cleanup ordering, protocol precedence, file exemptions, shared normalization, and the two levels of regression coverage as one adapter change.",
          "uncertaintyReasons": [
            "A false rejection of a valid status-zero environment would be a meaningful compatibility regression."
          ]
        },
        {
          "id": "target:change-item:change-validation:45f79e72d5be3a84e6a3:review-0001",
          "category": "manual-validation-debugging-and-hardening",
          "title": "Validate and harden the completed change",
          "scope": ".",
          "sourceWorkItemIds": [
            "change-item:change-validation:45f79e72d5be3a84e6a3"
          ],
          "evidenceIds": [
            "change:path:121486b04a87ac1c6f13f397",
            "change:path:2906fea3ec893bf8d630e735",
            "change:path:317ffe356eb21fea67aae703",
            "change:path:a11dc2ba063016c9d475861b",
            "change:path:ac4d27e2afe65cf3f626aeb5",
            "change:path:de0eb77c697692f27af8adb4"
          ],
          "hours": {
            "low": 1.00,
            "expected": 1.50,
            "high": 2.50
          },